<xs:schema xmlns:xs="http://www.w3.org/2001/XMLSchema">
    <xs:element name="menu">
        <xs:complexType>
                <xs:sequence>
                <xs:element name="receta">
                    <xs:complexType>
                        <xs:sequence>
                            <xs:element name="nombre"  type="xs:string"/>
                            <xs:element name="categoria">
                                <xs:simpleType>
                                    <xs:restriction base="xs:string">
                                        <xs:enumeration value="Entrante"/>
                                        <xs:enumeration value="Principal"/>
                                        <xs:enumeration value="Postre"/>
                                    </xs:restriction>
                                </xs:simpleType>
                            </xs:element>
                            <xs:element name="tiempo"  type="xs:integer"/>
                            <xs:element name="dificultad"    type="xs:string"/>
                        </xs:sequence>
                    </xs:complexType>
                </xs:element>
            </xs:sequence>
        </xs:complexType>
    </xs:element>
</xs:schema>